,Ingredient,Category
0, 청양고추 홍고추 양파 다진 마늘 식용유,Korean
1, 불린 쌀 소고기 안심 표고버섯 아욱 물,Korean
2, 비타민 사과 달걀노른자 올리브유,Korean
3, 불린 쌀 닭 안심 비타민 잎 물,Korean
4, 불린 쌀 무 표고버섯 대구살 물,Korean
5, 불린 쌀 소고기 안심 감자 물,Korean
6, 불린 쌀 새우 건미역 참기름 명이나물 장아찌,Korean
7, 불린 쌀 오이 시금치 소고기 안심 물,Korean
8, 두부 달걀 완두콩 모유 또는 분유,Korean
9, 불린 쌀 건미역 들깨 물,Korean
10, 돼지고기 콩나물 깻잎 양파 대파 청양고추 고추장 고춧가루 진간장 다진 마늘 설탕 맛술 후추 식용유,Korean
11, 굴 순두부 달걀 애호박 양파 대파 청양고추 홍고추 물 고춧가루 식용유 국간장 다진 마늘 설탕 소금 후추,Korean
12, 소고기  양지살  느타리버섯 팽이버섯 표고버섯 양파 대파 청양고추 홍고추 국간장 고추장 고춧가루 다진 마늘 설탕 된장 참기름 물,Korean
13, 북어채 양파 대파 감자 달걀 물 참기름 다진 마늘 국간장 소금 후추,Korean
14, 대패삼겹살 무우 애호박 청양고추 홍고추 대파 두부 양파 표고버섯 쌀뜨물 국간장 다진 마늘 고추장 된장 고춧가루,Korean
15, 소고기 설도  양파 당근 대파 배 진간장 국간장 올리고당 후추 설탕 다진 마늘 맛술,Korean
16, 대패삼겹살 감자 양파 느타리버섯 대파 청양고추 홍고추 물 고춧가루 설탕 국간장 고추장 다진 마늘 참기름 식용유,Korean
17, 닭 물 고사리 고춧가루 대파 다진 마늘 고춧가루 소금 후추 우유,Korean
18, 오징어 물 두부 당근 양파 파 달걀 밀가루 소금 후추 식용유,Korean
19, 홍합 양파 대파 청양고추 홍고추 다진 마늘 맛술 후추 물,Korean
20, 감자 대파 국물용 멸치 다시마        크기  물 들깨가루 들기름 다진 마늘 국간장 소금,Korean
21, 새우 부추 밀가루 부침가루 찬물 식용유 소금 후추,Korean
22, 프랑크소시지 맛살 단무지 조림우엉 달걀 밥 김밥용 김 소금 설탕 식초 깨 참기름 식용유 머스터드 소스,Korean
23, 두부 애호박 양파 청양고추 대파        멸치 다시마 육수 청국장 된장 다진 마늘 고춧가루,Korean
24, 참가자미    생수 맛술 소금 건미역 고춧가루  다진 마늘 다진 생강 들깨가루 들기름 국간장,Korean
25, 무우 멸치 다시마 육수 다진 마늘 들기름 들깨가루 국간장 소금,Korean
26, 섬초 홍고추 멸치 다시마 육수 된장 다진 마늘,Korean
27, 조선호박 홍고추 물 국간장 새우젓,Korean
28, 데친 쑥 멸치 다시마 육수 쪽파 양파 청고추 홍고추 된장,Korean
29, 미더덕 무 애호박 두부 양파 대파 청양고추 홍고추  생략 가능  멸치 다시다 육수 된장 고춧가루,Korean
30, 꼬막 청주 대파 양파 청양고추 홍고추 통깨 참기름 깨소금 후춧가루,Korean
31, 검은콩 현미 죽염 항암육수 카테고리 내 레시피 참조 ,Korean
32, 통마늘 우유 생크림 불린 찹쌀 물 포도씨유 소금,Korean
33, 고구마 멥쌀 현미 물,Korean
34, 시금치 된장 물 보리새우 다진마늘 국간장,Korean
35, 불린 쌀 생굴 무우 물 다진마늘 쪽파 또는 달래  통깨 후추 매실액,Korean
36, 닭가슴살 새우 대파  흰부분  다진 마늘 영양부추 홍고추 청고추 깻잎 간장,Korean
37, 현미밥 느타리버섯 표고버섯 깻잎 팽이버섯 우민찌  소고기 갈은 것  포도씨유,Korean
38, 김 대파 다진마늘 진간장 물 건새우 소금 참기름,Korean
39, 밥 달걀 물 참치캔 작은캔  피자치즈 대파 간장 청고추  생략 가능  홍고추  생략 가능  후춧가루,Korean
40, 고사리 소면 대파 청양고추 통깨 달걀노른자 소금,Korean
41, 통 삼겹살  또는 목살  신 김치 대파 홍고추 청양고추 멸치 다시마 육수,Korean
42, 무 차돌박이 대파 홍고추 청양고추 다시마 멸치육수  또는 쌀뜨물 ,Korean
43, 국수호박 달걀 표고버섯 청고추 홍고추 육수용 멸치 다시마 물,Korean
44, 손질 낙지 양파 미나리 청양고추 홍고추 당근 소금 통깨,Korean
45, 단감 대파  흰 부분  쪽파 통깨,Korean
46, 잘게 썬 배추김치  신김치  순두부 애호박 표고버섯 대파 양파 청양고추 다시마 물 고추기름 소금,Korean
47, 쪽파 국간장 설탕 다진 마늘,Korean
48, 굴 부추 청양고추 홍고추 식용유,Korean
49, 두부 다진 쇠고기 표고버섯 오이 다진 마늘 당근 소금 식용유 부침가루  생략 가능  쪽파  생략 가능 ,Korean
50, 육전 중면 묵은지 오이 당근 쪽파 통깨 다진 마늘 참기름 통깨,Korean
51, 배추 파프리카  빨강  주황  노랑  무 쪽파 굵은 소금 꽃소금 다진 생강,Korean
52, 소갈비 유부 주머니 가래떡 미나리 배추속대 만가닥 버섯 단호박 청경채 대파 숙주 물,Korean
53, 애호박 양파 소금 통밀가루 식용유,Korean
54, 모둠 건 해초 두부 밥 김밥용 김 오이 당근 식용유 소금 들기름,Korean
55, 배추 무 소금 밀가루 식용유 다진 양파 참기름 통깨,Korean
56, 모둠 건 해초 날치알 적양배추 오이 밥 참기름 통깨,Korean
57, 삼겹살 또는 오겹살 대파 부추 양파 묵은지 또는 명이나물 사과 통마늘 생강  마늘  쪽 사이즈  통후추 건고추 월계수 잎,Korean
58, 쇠고기 불고기용  쪽파 양파 청양고추 홍고추 달걀 식용유,Korean
59, 쌀 건 곤드레 새송이버섯 들기름 다시마  육수  또는 물  다진 청양고추 참기름 통깨,Korean
60, 가지 다진 쇠고기 불린 쌀 마늘 쪽파 식용유 다시마 육수 후춧가루,Korean
61, 손질된 한치 미나리 오이 양파 청고추 홍고추 통깨 후춧가루,Korean
62, 청국장 배추김치  숙성  양파 무 두부 대파 애호박 홍고추 김칫국물 멸치 다시마 육수 참기름,Korean
63, 당근 달걀 밥 김밥 김 식용유 소금 다진 마늘 참기름,Korean
64, 두부 스팸 감자 양파 대파 청양고추 멸치 다시마 육수 설탕 후춧가루,Korean
65, 김밥 김 소 등심 달걀 케일  깻잎 또는 상추로 대체 가능  빨간 파프리카 오이 소금 후춧가루 식용유,Korean
66, 쇠고기  불고기용  배추속대 양파 대파 표고버섯 느타리버섯 팽이버섯 부추 당면 다시마 육수,Korean
67, 중면 열무김치 통깨 열무김치 국물 물 오이 삶은 달걀,Korean
68, 중면 생미역 오이 대파 양파 당근 통깨 소금,Korean
69, 양배추 쪽파 굵은 소금 다진 생강 매실액  올리고당으로 대체 가능 ,Korean
70, 소면 유부 당근 미나리 양파 청양고추 홍고추 채수 소금 식용유,Korean
71, 청양고추 당근 어묵 밥 김밥용 김 통깨 참기름 식용유 마요네즈,Korean
72, 달걀 양파 꽈리고추 쪽파 멸치 육수 참기름 통깨 소금 식초,Korean
73, 비건 소시지 템페 채소 만두 베이크드빈 팽이버섯 표고버섯 두부 대파 양파 잘게 자른 김치 라면 사리 채수  생수 또는 다시마 우린 물로 대체 가능 ,Korean
74, 콩나물  찜용  사각 어묵 양파 대파 청양고추 쪽파 통깨 참기름 식용유 다시마 멸치 육수,Korean
75, 검은콩  서리태  물  콩 불린 국물  물엿 통깨,Korean
76, 배추 무 쪽파 파프리카  생략 가능  배 사과 마늘 생강 굵은 소금,Korean
77, 골뱅이 통조림 돌나물 깻잎 대파 오이 당근 양파 통깨 다진 마늘 참기름 후춧가루 통깨,Korean
78, 참소라 소면 양파 대파 오이 당근 양배추 잎 통깨 참기름 통깨 생강가루 후춧가루,Korean
79, 배추 쪽파 무 굵은 소금 생강 다시마 물,Korean
80, 쌀 두릅 바지락,Korean
81, 쌀 키조개 슬라이스 관자 애호박 다시마 냉침 육수,Korean
82, 쌀 단호박 익은 김치 새우 대하 ,Korean
83, 갓 지은 솥밥 오징어 몸통  어묵 사각어묵  청피망 양파 대파 고추기름,Korean
84, 데친 쑥 잔 멸치 다진 견과류 통깨 밥,Korean
85, 데친 쑥 양파 식용유 다진 양파 다진 청양고추 고춧가루 통깨,Korean
86, 제주 삼겹살 제주 생고사리 김치 감자 새송이버섯 마늘 양파 청양고추,Korean
87, 미더덕 콩나물 미나리 멸치 다시마 육수 양파 대파 참기름 통깨,Korean
88, 꽃게  냉동  양파 청양고추 홍고추 쪽파 청주 다진 마늘 통깨 생강가루 후춧가루,Korean
89, 꽃게  암게  홍고추 청양고추 마늘 레몬  생략 가능  가다랑어포 물 통후추,Korean
90, 오이 홍고추 소금 식용유 들기름 통깨,Korean
91, 청포묵 쪽파 홍고추 통깨 조미김 소금 참기름 간장,Korean
92, 애호박 다진 마늘 통깨 식용유 참기름 채수 소금 다진 파 후추,Korean
93, 표고버섯 양파 당근 파프리카 다진 마늘 식용유 통깨 참기름,Korean
94, 두릅 소금 대파 청양고추  생략 가능  홍고추  생략 가능  참기름 통깨 통깨,Korean
95, 마늘종 소금 식용유 참기름 통깨,Korean
96, 연근 작은 사이즈  식초 소금 올리고당 참기름 통깨,Korean
97, 두릅 소고기  불고기감  식용유 전분 통깨 소금,Korean
98, 돼지고기 감자 양파 대파 청양고추 두부 다시마 육수  물로 대체 가능  맛술 식용유,Korean
99, 두부 콩나물 대파 양파 청양고추 멸치 다시마 육수 식용유 참기름 후춧가루,Korean
100, 가지 홍고추 쪽파 통깨 참치액 다진 파 다진 마늘 참기름 후춧가루,Korean
101, 돼지고기  앞다릿살 또는 목살  배추김치  신김치  순두부 대파 양파 청양고추 홍고추 달걀 멸치 다시마 육수 고추기름,Korean
102, 콩나물 미나리 통깨 올리고당 참기름 소금 후춧가루,Korean
103, 가지 대파 흰 부분 통깨 송송 썬 쪽파  대파로 대체 가능  식용유,Korean
104, 콩나물 삶은 달걀 쫄면 통깨 올리고당 간장 다진 마늘 참기름 후춧가루,Korean
105, 김치 김치 국물 콩나물 대파 찬밥 국간장 고춧가루 청양고추  생략 가능  참기름 김가루 통깨,Korean
106, 오징어  중간 사이즈  양파 양배추 대파 애호박 당근 풋고추 홍고추 참기름 통깨 식용유,Korean
107, 오이고추 올리브 참기름 통깨,Korean
108, 달래 다진 쇠고기 소면 홍고추 통깨 깨소금 후춧가루,Korean
109, 미나리 모시조개 홍고추 청양고추 다시마         물 소금,Korean
110, 미나리 식용유 물 잘게 썬 양파 홍고추 통깨,Korean
111, 두부  부침용  미니 새송이버섯 표고버섯 마늘 홍고추 청양고추 들기름 통깨,Korean
112, 쌈 다시마  염장 다시마  낙지 젓갈 홍고추 청양고추 실파 부추 다진 마늘 참기름 통깨 밥,Korean
113, 톳 잔 새우 두부 홍고추 쪽파 통깨,Korean
114, 물 양파 대파 마늘 다시마  사방       건표고버섯 무,Korean
115, 바지락 홍고추 청양고추 양파 미나리 대파 오이 당근 배 통깨 물 청주 참기름 통깨,Korean
116, 쌀 바지락 냉이 홍고추 간장 참기름 물 청주,Korean
117, 흑돼지 삼겹살 새송이버섯 미나리 양파 청양고추 마늘,Korean
118, 양파 마늘 애호박 홍고추 청양고추 대파 참기름 멸치 다시마 육수 새송이버섯,Korean
119, 톳 장아찌 두부 흑미밥 김밥용 김 오이 당근 식용유 소금 통깨,Korean
120, 쌀 톳 장아찌 연근 표고버섯 쪽파 다시마 육수 참기름 당근,Korean
121, 대파 마늘 달걀 식용유 소금,Korean
122, 달걀 대파 물 새우젓 국간장 맛술 후춧가루,Korean
123, 자숙 문어 쌀 물 무 깻잎 맛술 다시마 삶은 달걀  생략 가능 ,Korean
124, 시금치나물 고사리나물 콩나물 고추 장아찌 현미밥 김밥용 김 달걀 식용유 소금 통깨,Korean
125, 묵은지 밥 참치 깻잎 양파 통깨 참기름,Korean
126, 김밥용김 밥 슬라이스 치즈 상추 식용유,Korean
127, 당면 표고버섯 느타리버섯 당근 양파 부추 통깨 물 식용유 소금,Korean
128, 조랭이떡 다진 쇠고기 대파 달걀 멸치 다시마 육수 참기름 후춧가루,Korean
129, 닭 달걀 대파 마늘 생강  밤  톨 사이즈  통후추,Korean
130, 간 돼지고기 부추  만두소      만두 묶을 때 사용      양파 건당면 애호박 느타리버섯 소금 깨,Korean
131, 왕만두 달걀 대파 멸치 다시마 육수,Korean
132, 제주 밥심 누룽지 황태 송송 썬 대파 다시마 육수 참기름 통깨 소금 간장 참치액,Korean
133, 깐 더덕 송송 썬 쪽파  생략 가능  통깨 간장 설탕 식초 다진 파 다진 마늘 참기름 통깨,Korean
134, 쇠고기  불고기용  우엉 아스파라거스 참기름 통깨 식초 다진 마늘 참기름 후춧가루,Korean
135, 매생이 새우살 홍고추 부침가루 식용유,Korean
136, 무 쪽파 배 양파 대파 청양고추 홍고추 굵은 소금 설탕,Korean
137, 굴 무 맛술 굵은 소금 통깨,Korean
138, 조랭이떡 굴 매생이 달걀 멸치 다시마 육수 참기름,Korean
139, 가래떡 무 어묵 대파 다시마 멸치 육수,Korean
140, 칼국수 면 가리비  소  미더덕  또는 오만둥이  감자 양파 대파 청양고추 팽이버섯 멸치 새우 다시마 육수 굵은 천일염,Korean
141, 자숙 꼬막살 부추 청양고추 홍고추 양파 맛술 참기름 후춧가루 식용류,Korean
142, 꽁치통조림 무 청양고추 홍고추 양파 대파 멸치다시마 육수 후춧가루,Korean
143, 삶은꼬막 시금치 섬초  대파 홍고추 멸치다시마 육수,Korean
144, 감태 명란젓 마요네즈 식용유 다진 호두  생략 가능 ,Korean
145, 무 대파  흰부분  쪽파 굵은 소금 고춧가루 설탕,Korean
146, 무말랭이 말린 고춧잎 통깨 다진 파 다진 마늘 참기름 통깨,Korean
147, 삶은 시래기나물 대파 홍고추 쌀뜨물 국멸치 다시마  사방      된장 들깨가루  탈피 ,Korean
148, 총각무 대파  흰부분  쪽파 굵은 소금 생강  마늘  쪽 사이즈 ,Korean
149, 저염 명란젓 갈은 돼지고기 날치알 양배추 양파 부추 청양고추 달걀 만두피 밀가루,Korean
150, 중면 차돌박이 오이 대파 청상추 홍고추 통깨 소금,Korean
151, 두부 다진 돼지고기 배춧잎 새송이버섯 표고버섯 대파 청경채 전분가루 다시마멸치육수,Korean
152, 모둠전 무 대파 양파 청양고추 홍고추 쑥갓 다시마 멸치 육수,Korean
153, 손질한 고구마줄기 양파 실파 굵은 소금 통깨,Korean
154, 표고버섯 다진 쇠고기 두부 양파 당근 달걀 밀가루 식용유 후춧가루,Korean
155, 삶은 고사리 멸치다시마육수  또는 물  들기름 통깨 후춧가루,Korean
156, 훈제오리 쌈무 오이 레드양파 크래미 맛살 파프리카  빨강  주황  알파파  또는 무순  깻잎 황도 스위트칠리 소스  시판 ,Korean
157, 낙지 꽈리고추 느타리버섯 밀가루 굵은 소금 통깨 식용유 꼬치 다진 마늘 생강가루 통깨 후춧가루,Korean
158, 새우 다진 돼지고기 양파 당근 홍고추 청고추 실파 달걀 밀가루 맛술 식용유,Korean
159, 쌀 송이버섯 백만송이버섯  또는 느타리버섯  은행 실파 다시마육수,Korean
160, 알배추 무 오이 홍고추 배 쪽파 미나리 굵은 소금 고춧가루,Korean
161, 깐도라지 소금 멸치다시마육수 또는 물  들기름 통깨,Korean
162, 쌀 다시마 육수 명란젓 단호박 쪽파 참기름,Korean
163, 밥 삼겹살 김밥용 김 단무지 당근 오이 깻잎 오이고추 청상추 우엉 식용유 소금 후춧가루 참기름 통깨,Korean
164, 오이 쇠고기 불고기용  달걀 홍고추 당근 통깨 후춧가루,Korean
165, 풋고추 청양고추 통마늘 식초,Korean
166, 김말이 청피망 파프리카 양파 고추기름 물,Korean
167, 오이지 홍고추 쪽파 통깨 참기름,Korean
168, 칼국수면 애호박 감자 양파 대파 청양고추 달걀 구운 소금 김가루 통깨 멸치 새우 다시마 육수,Korean
169, 초당 옥수수 쌀 물 다시마         소금 버터,Korean
170, 골뱅이 통조림 깻잎 무순 홍고추 대파 오이 양파 통깨 통깨,Korean
171, 밥 단무지 당근 오이 깻잎 청상추 맛살 판어묵 달걀 김밥용 김 식용유 소금 맛술,Korean
172, 쇠고기 불고기용  익은 배추김치 줄기부분  애호박 당근 밥 맛술 참기름 소금 후춧가루 식용유 통깨,Korean
173, 달걀 묵은지 판어묵 김밥용 김 밥 소금 식용유 참기름,Korean
174, 두부 돼기고기 목살  신김치 대파 양파 홍고추 청양고추 참기름 통깨 식용유 멸치 다시마 육수,Korean
175, 콩나물 실파 통깨 깨소금 간장 국간장  소금,Korean
176, 차돌박이 쪽파 부추 배춧잎 숙주나물 청경채 새송이 버섯 팽이버섯 단호박 당근,Korean
177, 돼지고기 통삼겹살  오이 파프리카 노란색  양파 홍고추 통깨 생강 마늘 쪽 크기  월계수잎 통후추,Korean
178, 감자  중간크기  양파 홍고추 대파 참기름 식용유 통깨 멸치다시마육수  또는 물 ,Korean
179, 미나리 오징어 몸통 중간사이즈  연근 비트 파프리카 소금 초고추장,Korean
180, 꽁치통조림 배추김치 대파 청고추 홍고추 멸치다시마육수 식용유,Korean
181, 두릅 새송이버섯 부침가루 달걀 소금 꼬치 식용유,Korean
182, 간장 굴소스 맛술 청주 설탕 조청 양파 배 마늘 대파 흰부분  생강가루 참기름 후춧가루 물,Korean
183, 쌀 무채 무즙 굴 표고버섯 느타리버섯 은행,Korean
184, 냉이 배춧잎 양파 대파 홍고추 청양고추,Korean
185, 사과 계피 꿀 식초,Korean
186, 알배추 쪽파 또는 대파  통깨 설탕 물엿 생강가루 참기름,Korean
187, 관자 쇠고기 채끝살 또는 살치살  표고버섯 미니 새송이 버섯 올리브유 명이나물 또는 장아찌  소금 후춧가루,Korean
188, 무 식용유 참기름 통깨 소금 멸치 다시마 육수,Korean
189, 마늘 건고추 올리브유 참기름 통깨,Korean
190, 쪽파 깐쪽파  멸치액젓 설탕 다진마늘,Korean
191, 찹쌀 멥쌀 팥 찰수수 검은콩 찰기장 밤,Korean
192, 달걀 밥 대파 스팸 통깨 식용유,Korean
193, 달걀 다시마 물 당근 양파 쪽파 식용유,Korean
194, 돼지고기 숙주 양파 부추 달걀 전분가루 밀가루 소금 후춧가루,Korean
195, 엿기름 물 쌀 멥쌀  설탕 생강 잣 생략가능  대추 생략가능 ,Korean
196, 새우 청주 청양고추 홍고추 레몬 설탕 다시마 사방      양파 사과 대파 청양고추 건고추 통후추 마늘 생강,Korean
197, 새우 중하  다진 돼지고기 신김치 부추 애호박 소금,Korean
198, 아귀 미더덕 또는 오만둥이  일자콩나물 찜용  대파 미나리 홍고추 청양고추 멸치새우다시마육수 참기름 구운 소금 통깨,Korean
199, 코다리 전분가루 옥수수전분  페페론치노 또는 건고추  실파 통깨 식용유 참기름 다진마늘 생강가루 물 후춧가루,Korean
200, 팥 멥쌀 물 설탕 소금,Korean
201, 쇠고기 불고기용  낙지 배춧잎 애호박 양파 대파 백만송이버섯 표고버섯 홍고추 풋고추 쑥갓 밀가루 굵은소금 맛술 다시마멸치육수,Korean
202, 돼지등뼈 감자 삶은 무청 시래기 또는 데친 얼갈이 배추  대파 청양고추 홍고추 깻잎 들깻가루 통후추 후춧가루,Korean
203, 꽃게 다진 쇠고기 두부 숙주 배춧잎 무 애호박 청고추 홍고추 대파 쑥갓 달걀 밀가루 다시마 청주 구운 굵은 소금,Korean
204, 돼지고기 목살 영양 부추 당근 양파 통깨 다진 마늘 생강가루 후춧가루,Korean
205, 늙은 호박 부침가루 설탕 소금 식용유,Korean
206, 고등어 청고추 홍고추 실파 전분 통깨 맛술 소금 식용유 후춧가루,Korean
207, 쇠고기 양지 또는 사태  무 콩나물 대파 홍고추 고춧가루 다시마육수,Korean
208, 차돌박이 두부 표고버섯 무 애호박 양파 대파 홍고추 청고추 다시마 멸치육수,Korean
209, 낙지 바지락조개 알배추 무 미나리 두부 대파 청양고추 홍고추 멸치 다시마 육수 밀가루 굵은소금,Korean
210, 감자 명란젓 마늘 실파 소금 올리브오일 참기름,Korean
211, 쇠고기 불고기용  양파 당근 대파 버섯류 생략가능  참기름 통깨 간장 설탕 다진파 다진마늘 참기름 깨소금 후춧가루,Korean
212, 건미역  불린 미역  굴 무 다시마멸치육수 들기름 소금,Korean
213, 항정살 부추 오이 양파 소금 후춧가루 통깨,Korean
214, 건새우 애호박 양파 당근 청양고추 식용유,Korean
215, 깻잎 대파 쪽파 양파 당근 설탕 올리고당 통깨,Korean
216, 파래김 쪽파 홍고추 통깨 참기름,Korean
217, 갈비 무 표고버섯 대파 생강 통후추 물,Korean
218, 배 도라지 백설탕 꿀 소독한 밀폐 유리병,Korean
219, 콩나물 찜용  건당면 애호박 느타리버섯 양파 당근 시금치 소금 참기름 식용유 통깨,Korean
220, 쇠고기 불고기용 또는 차돌박이  깻잎 팽이버섯 쪽파 숙주 연근 가지 참기름 소금 후춧가루,Korean
221, 건미역 황태 참기름 물 후춧가루,Korean
222, 닭 숙주 불린 고사리 느타리버섯 양파 대파 무 고추기름 소금,Korean
223, 오징어채 다진 마늘 마요네즈 송송 썬 쪽파 통깨 참기름 식용유,Korean
224, 명란젓 두부 애호박 양파 대파 청양고추 홍고추 다시마 멸치육수,Korean
225, 차돌박이 떡볶이 떡 어묵 대파 양배추 깻잎 삶은 달걀 통깨 후춧가루,Korean
226, 돼지고기 앞다리살 또는 목살  애호박 양파 대파 청양고추 홍고추 다시마 멸치 육수 또는 쌀뜨물 ,Korean
227, 부추 당근 오징어 청양고추 홍고추 식용유,Korean
228, 깍두기 대패삼겹살 달걀 공기밥 김가루 대파 쪽파 식용유 통깨,Korean
229, 오이 양파 소금 통깨 참기름 간장 다진마늘,Korean
230, 꽈리고추 부침가루 또는 밀가루  홍고추 참기름 통깨,Korean
231, 가지 청양고추 홍고추 양파 얼음 통깨,Korean
232, 양배추 부추 양파 굵은소금 물 통깨 매실청 소금,Korean
233, 삼계탕용 닭 전복 황태 불린찹쌀 불린녹두 참기름 물,Korean
234, 마눌종 통깨 식초 진간장 물 매실청 설탕 참기름,Korean
235, 소면 김치 오이 삶은달걀 청고추 홍고추 통깨,Korean
236, 감자 오이 당근 달걀 버터 소금 후춧가루,Korean
237, 해삼 전복 백골뱅이 멍게 배 오이 당근 양파 깻잎 청홍고추 어린잎채소 무순 얼음 청주 깨소금,Korean
238, 서리태 물 호두 잣 소금 꿀,Korean
239, 순대 양파 당근 양배추 대파 청양고추 깻잎 들깻가루 통깨 식용유,Korean
240, 오이 다진쇠고기 어린잎채소 청양고추 소면 통깨,Korean
241, 묵은지 참치       김밥용 김 오이 우엉 당근 단무지 맛살 달걀 깻잎 밥 소금 식용유 참기름 깨소금,Korean
242, 표고버섯 양파 당근 청양고추 다진마늘 카놀라유 통깨 참기름,Korean
243, 브로콜리 두부 찌개용  통깨 참기름,Korean
244, 생삼겹살 신김치 양파 대파 청양고추 홍고추 다시마멸치육수 후춧가루,Korean
245, 나무두릅 또는 땅두릅  베트남 고추 생략가능  식초 현미식초 또는 사과식초  설탕,Korean
246, 비엔나소시지 양파 파프리카 초록  노랑  빨강  식용유 파슬리 생략가능  통깨,Korean
247, 마늘종 꽃새우 건새우  소금 카놀라유 참기름 통깨,Korean
248, 쇠고기 우둔 또는 홍두깨살  깐마늘 꽈리고추 양파 통후추,Korean
249, 도미 대파 청양고추 홍고추 생강 실고추 생략가능 ,Korean
250, 냉이 불린 쌀 불린 현미 들기름 소금 물 통깨,Korean
251, 돌문어 양배추 양파 대파 청양고추 홍고추 부추 다진마늘 밥 식용유 밀가루 굵은소금 참기름 통깨,Korean
252, 황태포 콩나물 양파 대파 청양고추 홍고추 물 들기름 통깨,Korean
253, 우엉 당근 오이 단무지 달걀 햄 판어묵 맛살 밥 김밥용 김 식용유 소금,Korean
254, 두부       묵은지 양파 대파 소금 식용유 참기름 통깨 검은깨,Korean
255, 봄동       홍고추 소금 통깨 설탕 참기름,Korean
256, 닭볶음탕용 닭 우유 파 치킨튀김가루 식용유 통깨 다진마늘 파 후추 참기름,Korean
257, 오징어 작은 사이즈  무 대파 청양고추 홍고추 다시마멸치육수,Korean
258, 게맛살 햄 쪽파 새송이버섯 달걀 부침가루 소금 식용유 나무꼬치 소금 후춧가루 고명용 홍고추,Korean
259, 딱새우 감자 미니단호박 꽈리고추 옥수수 레몬 월계수잎 생략가능 ,Korean
260, 쌈무 오이 당근 양파 크래미 맛살 또는 닭가슴살 훈제오리  파프리카 노랑  주황  무순 부추 소금,Korean
261, 표고버섯 새우살 전분가루 설탕 다시마 사방  센치 ,Korean
262, 쪽파 굴 새우살 조갯살 오징어 달걀 청양고추 홍고추 식용유,Korean
263, 삼겹살 대파 양파 통깨 물엿 설탕 다진마늘 참기름 생강가루 후춧가루,Korean
264, 어묵 양파 청양고추 대파 참기름 식물성유 참기름 통깨,Korean
265, 닭 볶음용       감자 대파 떡볶이떡 부추 양배추 물,Korean
266, 무 국멸치 굵은멸치  홍고추 청양고추 대파 다시마육수,Korean
